{"fields":{"name":"Prabhat Katyayan Mishra","location":"Cambridge, MA","email":"prabhat0104@gmail.com","affiliations":[{"position":"Visiting Fellow","institution":"Kenneth C. Griffin Graduate School of Arts and Sciences, Harvard University","location":"Cambridge, Massachusetts","dates":"August 2024 - May 2025"},{"position":"Senior Visiting Scholar","institution":"School of Public Policy and Management, Tsinghua University","location":"Beijing","dates":"September 2023 - July 2024"},{"position":"Visiting Scholar","institution":"Mandarin Training Centre, National Taiwan Normal University","location":"Taipei","dates":"September 2022 - August 2023"},{"position":"Assistant Professor (adjunct)","institution":"Delhi School of Journalism, University of Delhi","location":"Delhi","dates":"April - July 2022"}],"education":[{"degree":"PhD candidate","field":"Centre for the Study of Law and Governance","university":"Jawaharlal Nehru University (JNU)","location":"New Delhi","dissertation":"AI Governance in China"},{"degree":"MPhil","field":"Centre for the Study of Law and Governance","university":"Jawaharlal Nehru University (JNU)","location":"New Delhi","dissertation":"Topologies of Ethical AI","year":2022},{"degree":"MA (Distinction)","field":"Communication and Media Governance","university":"Jamia Millia Islamia University","location":"New Delhi","year":2018},{"degree":"BA (Honours)","field":"Chinese Studies","university":"Jawaharlal Nehru University (JNU)","location":"New Delhi, India","year":2015}],"scholarships_and_awards":[{"name":"Harvard University AI Policy Fellowship","year":2024},{"name":"Harvard-Yenching Institute Doctoral Fellowship","year":"2021-2025"},{"name":"Senior Research Fellowship (SRF)","organization":"University Grants Commission","year":"2020-2023"}]},"text":"Prabhat Katyayan Mishra\nCambridge MA\nprabhat0104@gmail.com\nprabhat mishra@fas.harvard.edu\nAFFILIATIONS\nVisiting Fellow , Kenneth C. Griffin Graduate School of Arts and Sciences , Harvard University ,\nCambridge , Massachusetts . August 2024 - May 2025 .\nSenior Visiting Scholar , School of Public Policy and Management , Tsinghua University , Beijing .\nSeptember 2023 - July 2024 .\nVisiting Scholar , Mandarin Training Centre , National Taiwan Normal University , Taipei . September\n2022 August 2023 .\nAssistant Professor ( adjunct ) , Delhi School of Journalism , University of Delhi , Delhi .\nApril - July 2022 .\nEDUCATION\nPhD candidate , Centre for the Study of Law and Governance , Jawaharlal Nehru University ( JNU ) ,\nNew Delhi . Dissertation : ' AI Governance in China ' .\nMPhil , Centre for the Study of Law and Governance . Dissertation : ' Topologies of Ethical AI ' . 2022\nMA ( Distinction ) , Communication and Media Governance , Jamia Millia Islamia University , New\nDelhi . 2018\nBA ( Honours ) , Chinese Studies , Jawaharlal Nehru University ( JNU ) , New Delhi , India . 2015\nSCHOLARSHIPS AND AWARDS\nHarvard University AI Policy Fellowship ( 2024 )\nHarvard - Yenching Institute Doctoral Fellowship ( 2021-2025 )\nSenior Research Fellowship ( SRF ) University Grants Commission ( 2020-2023 )"}